{
  "schemaVersion": 2,
  "provider": "github-actions-godot-ios",
  "id": "match-picture-1.1.7",
  "repository": "seorilabs/match-picture-app",
  "releaseTag": "v1.1.7",
  "packageName": "com.github.magicsih.MatchSymbol",
  "baselineSourceSha": "f104d5dfae88dce5f51a6266dc40865cce74e9f0",
  "approvalFile": "match-picture-1.1.7.approval.json",
  "observationsFile": "match-picture-1.1.7.observations.json",
  "approvedAt": "2026-10-13T13:41:40Z",
  "approvalSha256": "c87b4337838af0f7d6d4a90d2c1aa5732b8e14e51548350233ed780989a52f48",
  "proposalSha256": "4b4bc6470a38b8630644ce033b55cf4aa49deae3baea8ece3032e530a31ed286",
  "observationsSha256": "c4aef953d543da90609c22b142d0f9b62b9f99c9184c07ac05f4c0cfd89c24f3",
  "inventorySha256": "ba8b6a49ccb1ad8d4c689d419af3906266a47acfe5554ec6008b067af24d799a",
  "configurationObservationSha256": "7412a502c4a413c7b1ac9ddbba097e3b8650f2d4af63346d48ae14d4562e420d",
  "callerSha256": "290fc885cede78fc4db77f643add270177f7e22ffe8e64c676fc080850019025",
  "targets": [
    "app-store"
  ],
  "allowedAppFiles": [
    ".github/workflows/deploy-app-store.yml"
  ],
  "maxAgeHours": 168,
  "approvedRisks": [
    "native ATT/UMP prompt order, resume and denial/revocation behavior not verified on device",
    "native bridge ABI and actual advertising requests/display not verified on device",
    "iPhone/iPad input, safe area, awake behavior and Game Center not verified on device",
    "advertising revenue reduction, native runtime failure and App Review rejection remain possible"
  ],
  "revoked": false,
  "configurationFingerprints": {
    "app-store": "cfe0ec551d3534debcc74d9ff7579f0f807827e5b0af3973dfefbb1c524658da"
  },
  "iosBuildProvenance": {
    "provider": "github-actions",
    "workflowPath": ".github/workflows/godot-deploy-app-store.yml",
    "buildNumberAuthority": "release-tag"
  },
  "executionConfiguration": {
    "app-store": {
      "expectedInputs": {
        "GITHUB_ACTIONS": "true",
        "GITHUB_REPOSITORY": "seorilabs/match-picture-app",
        "GITHUB_EVENT_NAME": "workflow_dispatch",
        "GITHUB_REF": "refs/heads/main",
        "RUNNER_OS": "macOS",
        "RUNNER_ENVIRONMENT": "github-hosted",
        "GODOT_VERSION": "4.7.2",
        "GODOT_STATUS": "stable",
        "PROJECT_DIR": "godot",
        "IOS_EXPORT_PRESET": "iOS",
        "XCODE_PROJECT_PATH": "release-artifacts/ios/xcode/match-picture-app.xcodeproj",
        "EXPORT_OPTIONS_PLIST": "app-store/exportOptions.plist",
        "SCRIPTS_DIR": "tools",
        "PREPARE_PROJECT_SCRIPT": "tools/prepare_ios_privacy.sh",
        "POST_IMPORT_SCRIPT": "",
        "POST_EXPORT_PROJECT_SCRIPT": "tools/finish_ios_privacy.sh",
        "POST_EXPORT_VALIDATION_SCRIPT": "tools/validate_ios_privacy.sh",
        "SHOULD_UPLOAD": "true",
        "SEORI_EXCEPTION_BUNDLE_ID": "com.github.magicsih.MatchSymbol",
        "SEORI_EXCEPTION_SCHEME": ""
      },
      "analyticsMode": "disabled",
      "analyticsConfigurationSha256": "a6e052439ed88c0ce72e19fbb82ae0674902d1d7d0ed9b789474ff16e553af82",
      "sourceFiles": {
        "godot/project.godot": "4d5952ea3b2597c770195fdfbea8b030bf529ce32f17fb68d545e144eff75ea3",
        "godot/export_presets.cfg": "066ea19b289c7f464f5fe76811c9da22c6755d6bc47cd194e50feef3fab795ef",
        "godot/analytics.config.json": "a6e052439ed88c0ce72e19fbb82ae0674902d1d7d0ed9b789474ff16e553af82",
        "platform/ios/ad_privacy/ad_privacy.mm": "77d19b9f1e306e30c051cdab235fbdd4614bc86a3d6704ee32f50d8221a99c01",
        "tools/prepare_ios_privacy.py": "4c6dee2fc621d73bb60ec46dd9ab0d9b14bd632b95c4f752ce98ba9b74faed9b",
        "tools/prepare_ios_privacy.sh": "229006def8d82549680584c6724dded353c790c864fbbc9053bc5b79d21877ed",
        "tools/finish_ios_privacy.py": "7c18456a1c66aed5a61f687968bf34d93f70435d99bf2ea9d156529325d47e2a",
        "tools/finish_ios_privacy.sh": "4458208d9297456c38d71824fbc6f2f9ad51e42920e51d55008b997034e1e6e4",
        "tools/validate_ios_privacy.sh": "f6b9b09fc6c2d45da41a6f70ff35b2cdbdee82457d41f0f9b55346e571622183",
        "app-store/releases/1.1.7/sdk-privacy-manifests.json": "6e5252d45ffbc6d17ce357140e9edead5c15b5224941ce60e969682088c29ccc",
        "app-store/exportOptions.plist": "4d1d263b773714a985e172e86c8f71df5772bad56e99336be490c2097949230a"
      },
      "consumedSettings": {
        "godot/project.godot": {
          "application::config/version": "\"1.1.7\"",
          "admob::general/ios/app_id": "\"ca-app-pub-9932778305312246~3239589743\""
        },
        "godot/export_presets.cfg": {
          "preset.2::name": "\"iOS\"",
          "preset.2.options::application/bundle_identifier": "\"com.github.magicsih.MatchSymbol\"",
          "preset.2.options::application/short_version": "\"1.1.7\"",
          "preset.2.options::application/version": "\"1001007\"",
          "preset.2.options::plugins/MatchAdPrivacy": "true",
          "preset.2.options::entitlements/game_center": "true",
          "preset.2.options::privacy/tracking_enabled": "true"
        }
      }
    }
  }
}
